imdb_id,original_title,cn_titles,release_year,summary,genres,directors,scriptwriters,actors,length,douban_average_score,douban_star_rating,number_of_ratings,link
tt000156,人偶之家,人偶之家,2025,故事主角是失去五岁女儿芽衣的铃木佳惠（长泽雅美）和丈夫忠彦（濑户康史）。沉浸在悲伤中的佳惠，在古董市场找到一个与芽衣非常相似的可爱洋娃娃，并开始呵护它，逐渐恢复了活力。但是，佳惠和忠彦有了新的女儿真衣之后，两人就不再关注这个洋娃娃了。渐渐地，五岁大的真衣开始和洋娃娃玩耍，这个家庭接二连三地发生奇怪的事情。佳惠他们试图摆脱这个洋娃娃，但无论扔掉还是供奉，这个洋娃娃却莫名其妙地回来了！洋娃娃隐藏的秘密是什么？以及即将揭开的震撼真相是什么——！,恐怖,矢口史靖,矢口史靖,矢口史靖,110分钟,7.9,3.95,1533,https://www.douban.com/doubanapp/dispatch?uri=/movie/37134889
tt000157,魔法蓝精灵,魔法蓝精灵,2025,蓝精灵村庄每日载歌载舞一片欢乐，直到蓝爸爸（约翰·古德曼 John Goodman 配音）被格格巫绑架打破了平静，蓝妹妹（蕾哈娜 Rihanna 配音）带领蓝精灵勇闯现实世界，用魔法和智慧开启冒险。,喜剧 / 动画 / 奇幻 / 冒险,克里斯·米勒,帕姆·布雷迪,克里斯·米勒,90分钟(中国大陆),6.0,3.0,1999,https://www.douban.com/doubanapp/dispatch?uri=/movie/35929770
tt000158,久别·重逢,久别·重逢,2024,"那年盛夏，少女夏文萱（许恩怡 饰）与少年苏升华（陈卓贤 饰），因一张唱片相遇，但对这段青涩的爱情，不知能走多远……
多年后，已成为音乐人的苏升华（郑伊健 饰），在人生低谷时，意外重逢夏文萱（蔡思韵 饰）。被病困的夏文萱心痛眼前苏升华变化如此，决定为他送上最后礼物，希望这段旅程能让他找到人生改变……",剧情 / 爱情 / 奇幻,梁礼彦,梁礼彦,梁礼彦,106分钟,6.6,3.3,1402,https://www.douban.com/doubanapp/dispatch?uri=/movie/36478198
tt000159,此心安处,此心安处,2024,影片改编自理查德·麦圭尔同名漫画。这是一部关于百年间多个家庭分别住进了同一间房子后发生的一系列关于爱、失落、欢笑和泪水的故事。影片横跨时间长河，以极其特殊的视角捕捉到了最纯粹的人类体验，有生活教科书般的温馨，也有白日梦想家般的无限向往，有婚姻经营者的无奈，通过104分钟向观众呈现出一幕幕百年家庭众生相。,剧情,罗伯特·泽米吉斯,埃里克·罗思 / 罗伯特·泽米吉斯 / 理查德·麦奎尔,罗伯特·泽米吉斯,104分钟,7.4,3.7,13419,https://www.douban.com/doubanapp/dispatch?uri=/movie/35782224
tt000160,地下忍者,地下忍者,2025,本片改编自花泽健吾的同名漫画，讲述了曾经辉煌一时的日本忍者，在战后被GHQ解散组织而消失，不过，他们潜伏在世界的所有机关，现代也暗中活动着，据说人数约为20万人。但基层忍者经常找不到工作，其中之一的云隐九郎（山崎贤人 饰）隶属忍者组织“NIN”的末端忍者（下忍），过着与啃老族无异的生活。一天，闲得发慌的他被判了一项重大的“忍务”，那就是调查战后70多年来一直潜入地下的某个组织的动向，其名为——“地下忍者”。忍术、智谋、最新科技等驱使了一切，从未有过的战斗现在开始。,剧情 / 喜剧 / 动作,福田雄一,福田雄一 / 花泽健吾,福田雄一,123分钟,5.6,2.8,1816,https://www.douban.com/doubanapp/dispatch?uri=/movie/36838213
tt000161,海洋奇缘2,海洋奇缘2,2024,在祖灵突如其来的呼唤之下，莫阿娜（奥丽伊·卡瓦洛 Auli'i Cravalho 配音）、毛伊（道恩·强森 Dwayne Johnson 配音）和新船员们将启程航向大洋洲的彼端，一路深入危险未知的海域，面对一场前所未见的新冒险。,喜剧 / 动画 / 歌舞 / 奇幻 / 冒险,小戴夫·德里克 / 杰森·汉德 / 达娜·莱杜克斯·米勒,杰拉德·布什 / 达娜·莱杜克斯·米勒 / 贝克·史密斯 / 布莱森·春,小戴夫·德里克 杰森·汉德 达娜·莱杜克斯·米勒,100分钟,6.7,3.35,35892,https://www.douban.com/doubanapp/dispatch?uri=/movie/36768946
tt000162,误杀3,误杀3,2024,郑炳睿（肖央 饰）的宝贝女儿婷婷众目睽睽之下，遭神秘绑匪绑架，始终陪伴父女左右的李慧萍（佟丽娅 饰）与他一同展开救女行动。但狡诈绑匪轻松躲避警方负责人张景贤（段奕宏 饰）的密集追捕，更将救女心切的郑、李二人玩弄于股掌之间。绝望间，郑炳睿选择走上了一条通往地狱的救女之路，纵使化身“修罗”也不能放过伤害自己女儿的恶徒！殊不知一场更大的阴谋正在悄然展开，所有卷入其中的人都无法逃脱。,剧情 / 悬疑 / 犯罪,甘剑宇,陈思诚 / 武皮皮 / 李鹏 / 胡小楠,甘剑宇,109分钟,6.0,3.0,205136,https://www.douban.com/doubanapp/dispatch?uri=/movie/35815771
tt000163,砖墙谜攻,砖墙谜攻,2025,蒂姆和奥利维娅醒来后发现自己被困在公寓里，四周突然出现了一道坚不可摧、未来感十足的墙……而且他们并不孤单，整栋大楼和所有住户似乎都被封闭了起来。在无法获得外界援助的情况下，他们必须团结起来寻找出路。他们能及时解开这堵墙背后的谜团，并活下来吗？,剧情 / 科幻 / 悬疑 / 惊悚,菲利普·科赫,菲利普·科赫,菲利普·科赫,99分钟,5.4,2.7,3362,https://www.douban.com/doubanapp/dispatch?uri=/movie/36827697
tt000164,焚城,焚城,2024,"危险物质突发泄漏！24小时后危及香港全城。
如何及时阻止这场末日灾难，专家范伟立（刘德华 饰）与Cecilia（莫文蔚 饰）各执一词。同时，消防队长黎杰峰（白宇 饰）和队友已奉命奔赴未知前线。
随着末日的逼近，富商的黑色利益链也逐渐浮出水面，独享财富却要平摊灾难，这次危机究竟要如何才能化解？",剧情 / 动作 / 灾难,潘耀明,麦天枢 / 岑君茜 / 王颖瑶 / 杜瑞榕 / 辛雅,潘耀明,136分钟,6.8,3.4,126748,https://www.douban.com/doubanapp/dispatch?uri=/movie/36421884
tt000165,普通事故,普通事故,2025,只是一场意外，却又超乎意外。驾车撞死一条狗，男子与妻女来到陌生车房。凭其义肢走动时的声响，车房工认出司机或是当年施酷刑的狱吏。仇人送上门，雪恨更待何时。然而，狱中受折磨时双眼被蒙，嫌疑犯是行刑者确实无误？从早到晚奔波一轮，找来几个狱友确认俘虏身份，痛苦回忆涌上心头。在无 垠沙漠等待把他活埋私了，有若在人性荒原等待果陀，替天行道又是否问心无愧？以悬疑惊栗布局，暗黑写实的人物故事来自巴纳希狱中亲见亲闻，将苛政、滥权、以暴易暴一一置于道德伦理的天秤上，丈量人性轻重；悲愤中不失幽默，连消带打贪污贿赂之风。一面金棕榈奖，绝非意外。,动作 / 惊悚 / 犯罪 / 冒险,贾法·帕纳西,贾法·帕纳西,贾法·帕纳西,101分钟,7.6,3.8,837,https://www.douban.com/doubanapp/dispatch?uri=/movie/37247238
tt000166,黑煞女,黑煞女,2025,Panor是个年轻的处女生活在一个偏远的村庄中，只因为在她出生的那天村里有人举行了一场黑魔法的仪式，导致所有人都瞧不起她，认为她是不祥之兆，任何靠近她的人都会遭受诅咒。,剧情 / 惊悚 / 恐怖,普蒂蓬·塞西甲,普蒂蓬·塞西甲 / 纳塔波特·波楚姆尼安 / Nattamol Paethanom,普蒂蓬·塞西甲,124分钟,6.0,3.0,2172,https://www.douban.com/doubanapp/dispatch?uri=/movie/37090014
tt000167,喜宴(新版),喜宴(新版),2025,"讲述一群彼此选择为家人的朋友，如何在家庭期待、酷儿身份与文化认同的冲突中，经历各种意外与感动。
安琪拉（凯莉·玛丽·陈 饰）与伴侣李（莉莉·格莱斯顿 饰）因试管婴儿疗程屡屡失败，却无力负担新的疗程费用。而他们的好友珉（韩基灿 饰），虽是跨国企业家族的隐藏继承人，坐拥丰厚财富，却因学生签证即将到期而陷入困境。当他的男友克里斯（杨伯文 饰）拒绝求婚后，珉灵机一动，向安琪拉提出一桩交易——只要她愿意与他假结婚，助他取得绿卡，他便资助李的试管婴儿费用。
然而，他们原本打算低调进行的计划，却因珉的奶奶（尹汝贞 饰）突然从韩国飞来探访而彻底失控。这位精明的老夫人不仅对孙子的婚事半信半疑，还坚持要为他们办一场盛大的传统婚礼，让这场“交易”瞬间变成一场盛大而混乱的囍宴。随着婚礼逼近，两对情侣的感情与关系也面临前所未有的挑战——当承诺、家人与自我认同交织在一起，他们是...",喜剧 / 爱情 / 同性,安德鲁·安,安德鲁·安 / 詹姆斯·夏慕斯,安德鲁·安,102分钟,5.2,2.6,3226,https://www.douban.com/doubanapp/dispatch?uri=/movie/36869044
tt000168,剧场版,在长椅上,2024,"河畔的绿茵丛中静静伫立着一张长椅。某个黄昏时分，这对久别重逢的青梅竹马在狭小的座椅上并肩而坐。他们交换着欲言又止却饱含温情的话语，细碎的话语间流淌着难以言明的微妙情愫。
这张承载着故事的长椅见证着人间百态：谈分手的情侣遭遇醉汉搅局，离家出走的姐姐与追寻而来的妹妹在此相逢，市政厅职员正谋划着拆除这座承载记忆的公共设施。
本片以一张长椅为原点，用多线交织的长篇叙事捕捉当代都市人稍纵即逝的生命片段，在方寸之间勾勒出浮世众生的情感光谱。",剧情,奥山由之,莲见翔 / 根本宗子 / 奥山由之 / 生方美久,奥山由之,86分钟,8.0,4.0,1597,https://www.douban.com/doubanapp/dispatch?uri=/movie/37037753
tt000169,志愿军：存亡之战,志愿军：存亡之战,2024,"影片聚焦铁原阻击战。1951年5月，中国人民志愿军第63军刚刚结束了持续一个月的作战，就受命进驻铁原战场，正面对抗“联合国军”4个师。志愿军将士们浴血奋战，终于把敌军打上了谈判桌。
为了完成任务，63军189师的战士化整为零，把自己变成一根钉子，牢牢钉在阵地上。
1营阵地上，身为营教导员的李想（朱一龙 饰）立下“一步也不会再退”的誓言，死守阵地。
炮火连天中，李默尹（辛柏青 饰）一家三口在战场上团聚，一把钥匙，一顿战壕中的团圆饭，让这个因战争分离的小家更为亲密。
为了给新中国造出更好的武器，归国军工专家吴本正（朱亚文 饰）在张孝恒（欧豪 饰）的保护下进入战场。身为警卫员的张孝恒坚信，守住了吴本正，就是守住了祖国的未来。
孙醒（陈飞宇 饰）、杨三弟（张宥浩 饰）也纷纷来到铁原。63军全体将士一起，在铁原战场上筑成了一道冲不破的“铁长城”！",剧情 / 历史 / 战争,陈凯歌,陈凯歌 / 张珂,陈凯歌,144分钟,6.7,3.35,149009,https://www.douban.com/doubanapp/dispatch?uri=/movie/36296618
tt000170,隔楼女孩：我们之间的层距,隔楼女孩：我们之间的层距,2025,讲述了两名警察的女儿Jane和Ann之间的爱情与友情的故事。随着Jane即将搬离她成长的警察公寓，许多回忆涌上心头，这些回忆中包括了她与刚搬进公寓的年轻警察Don以及她暗恋的女孩Ann之间的情感纠葛，一些隐藏已久的秘密也随之浮出水面。,剧情 / 爱情 / 同性,吉拉萨雅·旺舒廷,吉拉萨雅·旺舒廷,吉拉萨雅·旺舒廷,130分钟,7.4,3.7,720,https://www.douban.com/doubanapp/dispatch?uri=/movie/35705765
tt000171,生命清单,生命清单,2025,亚历克斯·罗斯的母亲让她去完成童年的愿望清单时，她随之踏上了一段让人笑中带泪的旅程，并将在旅程中揭开家族秘密，收获爱情，并找到真正的自我。,剧情 / 喜剧 / 爱情,亚当·布鲁克斯,亚当·布鲁克斯 / Lori Nelson Spielman,亚当·布鲁克斯,123分钟,6.7,3.35,2282,https://www.douban.com/doubanapp/dispatch?uri=/movie/36708872
tt000172,致命录像带：超越,致命录像带：超越,2024,通过一部伪纪录片《未解之谜》五个故事娓娓道来：警察进入古宅寻找孩子遭遇神秘生物；一群印度狗仔队发现宝莱坞女星并非镜头般光鲜亮丽；几个朋友必须在遭遇外星人入侵之后与客机相撞的高空跳伞中幸存；动物权利组织闯进痛失爱犬的女士住宅后将经历至暗时刻；以及一位沙漠中的母亲调查莫哈韦沙漠幽浮飞船后成为飞船偷渡者……,恐怖,杰·齐尔 / 乔丹·唐尼 / 克里斯蒂安·朗 / 贾斯汀·朗 / 贾斯汀·马丁内兹 /  /  / 更多...,埃文·迪克森 / 乔丹·唐尼 / 迈克·弗拉纳根 / 克里斯蒂安·朗 / 贾斯汀·朗 /  /  /  /  /  / 更多...,杰·齐尔 乔丹·唐尼 克里斯蒂安·朗 贾斯汀·朗 贾斯汀·马丁内兹 维拉特·帕尔 凯特·西格尔,114分钟,6.4,3.2,10266,https://www.douban.com/doubanapp/dispatch?uri=/movie/36613461
tt000173,断魂小丑3,断魂小丑3,2024,在经历了小丑阿特的万圣节大屠杀后，西耶娜和她的兄弟正在努力重建他们破碎的生活。随着节日的临近，他们试图拥抱圣诞精神，把过去的恐怖抛在脑后。但就在他们以为自己安全的时候，小丑阿特回来了，决心把他们的节日欢乐变成一场新的噩梦。随着阿特释放出他扭曲的恐怖，节日很快就结束了，证明没有一个节日是安全的。,恐怖,达米安·利昂,达米安·利昂,达米安·利昂,125分钟,6.3,3.15,17294,https://www.douban.com/doubanapp/dispatch?uri=/movie/36221991
tt000174,红色一号：冬日行动,红色一号：冬日行动,2024,圣诞老人（J·K·西蒙斯 饰）被神秘绑架，北极安保主管（道恩·强森 饰）不得已与全世界最臭名昭著的赏金猎人（克里斯·埃文斯 饰）展开合作，他们寻遍全球、打遍天下，力求拯救圣诞节。,喜剧 / 动作 / 悬疑 / 冒险,杰克·卡斯丹,克里斯·摩根 / 海拉姆·加西亚,杰克·卡斯丹,123分钟,5.8,2.9,26289,https://www.douban.com/doubanapp/dispatch?uri=/movie/35516034
tt000175,痴人之爱,痴人之爱,2024,本作的主人公是河合譲治，他是一名曾在剧本比赛中获奖但至今未能正式出道的剧作家。故事从他在一家萧条的酒吧遇到一位自称为直美的女性开始展开。某天，譲治代替剧本课程的讲师，接下了改编自谷崎润一郎的《痴人之爱》的电影剧本创作任务。在创作过程中，譲治苦于写作瓶颈，与直美再次相遇并在关系逐渐加深中，经历了一段既甜蜜又苦涩且疯狂的时光。,剧情,井土纪州,小谷香织,井土纪州,106分钟,5.8,2.9,1081,https://www.douban.com/doubanapp/dispatch?uri=/movie/37070561
tt000176,再帮个小忙,再帮个小忙,2025,史蒂芬妮·斯莫瑟斯（安娜·肯德里克 Anna Kendrick 饰）和爱蜜莉·尼尔森（布蕾克·莱弗利 Blake Lively 饰）在美丽的意大利卡普里岛重逢，参加爱蜜莉与意大利富商（米凯莱·莫罗尼 Michele Morrone 饰）的奢华婚礼。婚礼现场，一众衣着光鲜的客人举杯相庆，期间却有人离奇遇害和惨遭背叛。剧情一波三折，好比从大港通向卡普里镇广场的蜿蜒小路。,喜剧 / 悬疑 / 惊悚 / 犯罪,保罗·费格,达塞·贝尔 / 杰西卡·沙泽尔 / 莱塔·卡罗格里迪斯,保罗·费格,120分钟,5.6,2.8,5353,https://www.douban.com/doubanapp/dispatch?uri=/movie/35900116
tt000177,“骗骗”喜欢你,“骗骗”喜欢你,2024,打工女孩林晴朗（金晨 饰）被渣男张子骏（王皓 饰）欺骗，一夜之间甜蜜誓言变成201314元巨额债务。诈骗头子欧阳晖（孙阳 饰）的意外出现，给林晴朗的生活带来新的转机，两人联合“碰碰车车神”董晓惠（李雪琴 饰）、“骗场老炮”柏仕通（王耀庆 饰）设局开团，与张子骏斗智斗勇。一对“欢喜冤家”，一队“骗子天团”，一场“骗爱游戏”，结局将何去何从……,喜剧 / 爱情,苏彪,杨玉婷,苏彪,114分钟,6.4,3.2,172954,https://www.douban.com/doubanapp/dispatch?uri=/movie/36838707
tt000178,饥饿站台2,饥饿站台2,2024,一个神秘的领导者在站台上强制实施其统治，一个新居民卷入了反对这种备受争议的方法的斗争，反抗这一残酷的进食系统。但是，当从错误的盘子里进食就会招致死刑时，为挽救自己的生命，你愿意付出多大的努力？,科幻 / 惊悚 / 恐怖,加尔德·加兹特鲁·乌鲁蒂亚,大卫·德索拉 / 加尔德·加兹特鲁·乌鲁蒂亚 / 埃戈伊茨·莫雷诺 / 佩德罗·里韦罗,加尔德·加兹特鲁·乌鲁蒂亚,99分钟,5.6,2.8,28917,https://www.douban.com/doubanapp/dispatch?uri=/movie/36406672
tt000179,指环王：洛汗之战,指环王：洛汗之战,2024,影片改编自J·R·R·托尔金的经典巨著，故事设定在三部曲发生的200年前，讲述了洛汗国王“锤手”海尔姆家族的命运。当黑蛮地人领主伍尔夫为父复仇，发起猛烈攻势时，海尔姆和他的子民被迫退守到古老的号角堡要塞，这座堡垒日后被称为“海尔姆深谷”（也译作“圣盔谷”）。身处绝境之中，海尔姆的女儿赫拉奋力崛起，开始带领人民反抗这个意图彻底毁灭他们的致命敌人。,剧情 / 动作 / 动画 / 奇幻 / 冒险,神山健治,杰弗里·阿迪斯 / 威尔·马修斯 / 菲比·吉廷斯 / 阿尔蒂·帕帕乔治乌,神山健治,134分钟,6.1,3.05,9540,https://www.douban.com/doubanapp/dispatch?uri=/movie/35493148
tt000180,童心列车,童心列车,2024,1946 年，一个名叫阿梅里戈的七岁男孩离开那不勒斯贫困的家庭，乘火车前往北方的一个富裕家庭生活，这是战后拯救儿童贫困行动的一部分。,剧情 / 历史,克里斯蒂娜·科门奇尼,法里奥·安德烈奥蒂 / Viola Ardone / 吉利亚·卡伦达 / 克里斯蒂娜·科门奇尼 / Camille Duguay,克里斯蒂娜·科门奇尼,106分钟,7.6,3.8,1215,https://www.douban.com/doubanapp/dispatch?uri=/movie/36578173
tt000181,最爱今日天空，我却无法言明,最爱今日天空，我却无法言明,2024,每天都过着迷茫生活的大学生小西，和校内唯一的朋友山根和澡堂的打工伙伴打闹。 有一天下课，被团子头樱田端庄的样子所吸引，下定决心打招呼，机缘巧合下，两人很快一拍即合。 在对话不断的情况下，“我想每天都很开心。 我想我最喜欢今天的天空。”樱田不经意间说出的话刺痛了心。 奇怪的是，那句话和半年前去世的祖母的话一样。 就在这时，改变命运的冲击事件袭击了两个人。,剧情 / 爱情,大九明子,福徳秀介 / 大九明子,大九明子,127分钟,6.2,3.1,961,https://www.douban.com/doubanapp/dispatch?uri=/movie/37046033
tt000182,小雁与吴爱丽,小雁与吴爱丽,2024,小雁与Allie是两位长相一样的女人，一位为保护母亲而过失弑父；一位试图透过表演课理解人生。小雁服刑八年，刑满出狱后回到小镇，被邻里投以异样目光，人生无法重回正轨。当母亲的新男友醉后对母亲施暴，更让她感到命运似乎注定重演。当小雁和Allie的共同秘密被揭开，小雁能否彻底逃离悲剧命运？首度与妻子夏于乔合拍电影，更请来影后杨贵媚、曾国城等同场演出，配合多位曾获金马奖肯定的幕后班底，以镜像关系呈现母女之间的相爱相杀。如此相似的两母女，是不断重复的互相背叛，还是一辈子的陪伴和牵绊？,剧情,林书宇,林书宇,林书宇,108分钟,7.1,3.55,2579,https://www.douban.com/doubanapp/dispatch?uri=/movie/36117675
tt000183,苍茫的天涯是我的爱,苍茫的天涯是我的爱,2025,手持定制剧本，就能走上顶流之路？模范司机赵天涯（曾毅 饰）与一心想要爆火的Rapper于虹（周奇 饰）阴差阳错成为“师徒搭档”。于虹误以为赵天涯是MCN老板乌力吉（孙艺洲 饰）安排的真人秀NPC，误打误撞坐上老赵的大货车，由此踏上从内蒙古到湖南横跨5000公里的“送羊”闯关之旅。这一路，大开眼界。他们偶遇曼玉山庄董事长（柳岩 饰）慷慨解围，围观蒙古女孩Momo（王玉雯 饰）的绝美家族婚礼。在于虹以为自己即将走上人生巅峰之际，剧本走向却发生了天翻地覆的转变……,剧情 / 喜剧,陈孝良,陈孝良,陈孝良,108分钟,4.9,2.45,27687,https://www.douban.com/doubanapp/dispatch?uri=/movie/36978067
tt000184,回声谷,回声谷,2025,讲述女子凯特·加勒特因个人悲剧而摇摇欲坠，她在与世隔绝、风景如画的回声谷农场寄宿并训练马匹。一天深夜，她任性不羁的女儿克莱尔出现在家门口，惊恐颤抖、身上沾满了别人的血。一个母亲为了救她的孩子要付出多少？,剧情 / 惊悚,迈克·皮尔斯,布拉德·英格尔斯比,迈克·皮尔斯,104分钟,6.3,3.15,3047,https://www.douban.com/doubanapp/dispatch?uri=/movie/36303600
tt000185,BJ单身日记4,BJ单身日记4,2025,该片改编自原作小说的第三本，BJ此时五十岁出头，边适应着当代生活，边面对做母亲的责任。,剧情 / 喜剧 / 爱情,迈克尔·莫里斯,海伦·费尔丁 / 丹·马泽 / 艾比·摩根,迈克尔·莫里斯,124分钟,6.4,3.2,3989,https://www.douban.com/doubanapp/dispatch?uri=/movie/36848001
tt000186,浴火之路,浴火之路,2024,崔大路（肖央 饰）、李红樱（赵丽颖 饰）、赵子山（刘烨 饰），三位丢了孩子的父母因一桩交易而彼此牵连；他们眼里没魂儿，心中有恨，各怀目的，组局踏上寻子复仇之路，在蛮荒之地上演一场离奇又凶险的绝杀。,剧情 / 犯罪,五百,尚可,五百,126分钟,6.2,3.1,169643,https://www.douban.com/doubanapp/dispatch?uri=/movie/36211169
tt000187,粉丝来信,航海王,2024,故事讲述了顶上战争两年后的香波迪群岛上，娜美的小迷妹展开的一场小小冒险……本作改编自航海王官方外传小说《航海王 novel 草帽故事集》，小说描述了以一般人的角度来看待草帽海贼团成员们的短篇故事。,动作 / 动画 / 奇幻,石谷惠,丰田百香,石谷惠,25分钟,9.4,4.7,7257,https://www.douban.com/doubanapp/dispatch?uri=/movie/37069540
tt000188,角斗士2,角斗士2,2024,影片故事延续前作，路奇乌斯（保罗·麦斯卡 Paul Mescal 饰）童年时亲眼目击受万人景仰的英雄马克西蒙斯死于舅舅之手，多年后已长大成人的他，在暴君的铁腕统治下，被迫进入竞技场为生存而战。心中充满怒火的路奇乌斯，眼见罗马帝国的未来岌岌可危，决心讨回本属于他的权力和荣誉 ，还罗马人民一个辉煌的罗马。,剧情 / 动作 / 冒险,雷德利·斯科特,大卫·斯卡尔帕,雷德利·斯科特,148分钟,6.3,3.15,45998,https://www.douban.com/doubanapp/dispatch?uri=/movie/30368790
tt000189,那年圣诞不一样,那年圣诞不一样,2024,《那年圣诞不一样》改编自屡获殊荣的编剧兼导演理查德·柯蒂斯（《四个婚礼和一个葬礼》《诺丁山》《真爱至上》《昨日奇迹》）创作的迷人儿童读物三部曲，讲述了一系列关于爱与孤独、家人与朋友以及圣诞老人犯下大错的故事，火鸡更是要多少有多少！,喜剧 / 动画 / 家庭 / 奇幻 / 冒险,西蒙·奥托,理查德·柯蒂斯 / 彼得·苏特 / 安德鲁·道森 / 斯蒂夫·道森 / 蒂姆·因曼,西蒙·奥托,91分钟,7.2,3.6,2758,https://www.douban.com/doubanapp/dispatch?uri=/movie/35729390
tt000190,万王之王,万王之王,2025,查尔斯·狄更斯（肯尼思·布拉纳 配）给儿子瓦尔特·狄更斯（罗曼·格里芬·戴维斯 配）讲述一个故事，这场最初作为睡前故事的讲述，最终变成了一段改变人生的旅程。通过生动的想象，瓦尔特与耶稣（奥斯卡·伊萨克 配）并肩行走，见证奇迹。,剧情 / 动画 / 西部 / 奇幻,张诚浩,张诚浩 / 罗伯·爱德华兹 / Hoseok Sung / Jamie Thomason,张诚浩,100分钟,6.3,3.15,623,https://www.douban.com/doubanapp/dispatch?uri=/movie/35466485
tt000191,黑道中人,黑道中人,2025,罗伯特·德尼罗饰演两个角色：Vito Genovese和Frank Costello，两个不同的意大利黑道家族的老大，Genovese在1957年试图刺杀Costello，没杀了，但也导致了后者受伤并让出家族老大的位置。,剧情 / 传记 / 历史 / 犯罪,巴瑞·莱文森,尼古拉斯·派勒吉,巴瑞·莱文森,123分钟,6.6,3.3,1816,https://www.douban.com/doubanapp/dispatch?uri=/movie/36065333
tt000192,忍者蝙蝠侠大战极道联盟,忍者蝙蝠侠大战极道联盟,2025,蝙蝠侠与盟友从过去归来仅一天，就发现世界已非离开时的模样。整个日本岛不复存在，正义联盟的英雄们也集体消失。然而他们还没来得及理清头绪，更离奇的变故接踵而至——黑帮成员开始从天上纷纷坠落。,动作 / 动画 / 冒险,水崎淳平 / 高木真司,中岛一基,水崎淳平 高木真司,89分钟,7.5,3.75,3457,https://www.douban.com/doubanapp/dispatch?uri=/movie/36912440
tt000193,玉米地小丑,玉米地小丑,2025,一个日渐衰落的中西部小镇，曾经是成功象征的小丑弗兰多再次出现，并成为恐怖的祸害。,恐怖,艾利·克雷格,卡特·布兰查德 / 艾利·克雷格 / 亚当·切萨雷,艾利·克雷格,96分钟,5.6,2.8,2867,https://www.douban.com/doubanapp/dispatch?uri=/movie/36412909
